{
  "schemaVersion": 1,
  "id": "com.openhpsdr.zeus.samples.rxrecorder",
  "name": "RX Recorder",
  "version": "0.1.0",
  "author": "contributors",
  "description": "Records the demodulated RX (band) audio you hear to a WAV file, via the host's read-only RX audio tap. Capture-only: does not alter the audio or occupy an insert-chain slot. Realtime-safe — the audio thread writes a lock-free ring and a background thread flushes to disk. Recordings land under the plugin folder and are downloadable from the panel.",
  "homepage": "https://github.com/Kb2uka/openhpsdr-zeus-plugins",
  "license": "GPL-2.0-or-later",
  "sdk": {
    "abi": 1,
    "minVersion": "1.0.0"
  },
  "entrypoint": {
    "assembly": "RxRecorder.dll",
    "type": "Openhpsdr.Zeus.Samples.RxRecorder.RxRecorderPlugin"
  },
  "capabilities": [
    "PersistSettings"
  ],
  "ui": {
    "modules": [
      "ui/recorder.es.js"
    ],
    "panels": [
      {
        "id": "rxrecorder.main",
        "title": "RX Recorder",
        "icon": "Disc",
        "slot": "rx-audio-tools.chain"
      }
    ]
  }
}
