{
  "schemaVersion": 1,
  "id": "com.openhpsdr.zeus.samples.bass",
  "name": "Bass Enhancer (audio chain v1)",
  "version": "0.1.0",
  "author": "KB2UKA",
  "description": "Psychoacoustic bass enhancer — fourth of the Zeus voice audio chain v1 blocks per issue #332. MaxxBass / Aphex 204 'Big Bottom' Family-B approach: low-pass isolates the bass band, full-wave rectification generates octave-up harmonics, a high-pass strips the rectified DC + redundant fundamental, mix back over the dry signal. The ear hears the harmonic series and reconstructs the perceived bass fundamental without the radio transmitting frequencies the antenna can't efficiently radiate. Realtime managed C#, no native dependency.",
  "homepage": "https://github.com/Kb2uka/openhpsdr-zeus",
  "license": "GPL-2.0-or-later",
  "sdk": {
    "abi": 1,
    "minVersion": "1.0.0"
  },
  "entrypoint": {
    "assembly": "Bass.dll",
    "type": "Openhpsdr.Zeus.Samples.Bass.BassPlugin"
  },
  "capabilities": [
    "PersistSettings"
  ],
  "audio": {
    "slot": "tx.pre-cfc",
    "channels": 1,
    "sampleRate": 48000
  },
  "ui": {
    "modules": [
      "ui/bass.es.js"
    ],
    "panels": [
      {
        "id": "bass.main",
        "title": "Bass Enhancer",
        "icon": "Waves",
        "slot": "tx-audio-tools.chain"
      }
    ]
  }
}
