{
  "schemaVersion": 1,
  "id": "com.openhpsdr.zeus.samples.exciter",
  "name": "Aural Exciter (audio chain v2)",
  "version": "0.2.0",
  "author": "KB2UKA",
  "description": "Aural-Exciter-style top-end harmonic enhancement — third of the Zeus voice audio chain blocks per issue #332. Biquad high-pass filter feeds a tanh waveshaper to synthesise upper harmonics, then mixes the harmonics back over the dry signal. v0.2.0 adds Input + Output gain trims and live vertical IN/OUT peak meters flanking the saturation-curve centerpiece. Realtime managed C#, no native dependency.",
  "homepage": "https://github.com/Kb2uka/openhpsdr-zeus",
  "license": "GPL-2.0-or-later",
  "sdk": {
    "abi": 1,
    "minVersion": "1.0.0"
  },
  "entrypoint": {
    "assembly": "Exciter.dll",
    "type": "Openhpsdr.Zeus.Samples.Exciter.ExciterPlugin"
  },
  "capabilities": [
    "PersistSettings"
  ],
  "audio": {
    "slot": "tx.pre-cfc",
    "channels": 1,
    "sampleRate": 48000
  },
  "ui": {
    "modules": [
      "ui/exciter.es.js"
    ],
    "panels": [
      {
        "id": "exciter.main",
        "title": "Aural Exciter",
        "icon": "Sparkles",
        "slot": "tx-audio-tools.chain"
      }
    ]
  }
}
