{
  "schemaVersion": 1,
  "id": "com.openhpsdr.zeus.samples.reverb",
  "name": "Reverb (audio chain v2)",
  "version": "0.2.0",
  "author": "KB2UKA",
  "description": "Subtle Schroeder reverb — fifth and final block in the Zeus voice audio chain per issue #332. Four parallel comb filters with low-pass damping in the feedback path produce the decaying density; two series allpass filters diffuse the comb output so the tail doesn't ring. Tuned for ham-radio TX sweetening, not music — Mix defaults conservative so it sits behind the voice rather than washing over it. v0.2.0 adds Input + Output gain trims and live vertical IN/OUT peak meters flanking the impulse-response centerpiece. Realtime managed C#, no native dependency.",
  "homepage": "https://github.com/Kb2uka/openhpsdr-zeus",
  "license": "GPL-2.0-or-later",
  "sdk": {
    "abi": 1,
    "minVersion": "1.0.0"
  },
  "entrypoint": {
    "assembly": "Reverb.dll",
    "type": "Openhpsdr.Zeus.Samples.Reverb.ReverbPlugin"
  },
  "capabilities": [
    "PersistSettings"
  ],
  "audio": {
    "slot": "tx.pre-cfc",
    "channels": 1,
    "sampleRate": 48000
  },
  "ui": {
    "modules": [
      "ui/reverb.es.js"
    ],
    "panels": [
      {
        "id": "reverb.main",
        "title": "Reverb",
        "icon": "Aperture",
        "slot": "tx-audio-tools.chain"
      }
    ]
  }
}
