{
  "schemaVersion": 1,
  "id": "com.openhpsdr.zeus.samples.eq",
  "name": "10-Band Parametric EQ (audio chain v2)",
  "version": "0.2.0",
  "author": "KB2UKA",
  "description": "10-band parametric EQ with input + output gain stages and live FFT spectrum analyser. Per-band frequency / gain / Q, bypass with gain-still-applies semantics. Cascaded biquad peaking filters per the RBJ Audio EQ Cookbook. Live 2048-point input + output spectrum overlays under the EQ curve so the operator sees what the EQ is doing to their voice in real time. Realtime managed C#, no native dependency.",
  "homepage": "https://github.com/Kb2uka/openhpsdr-zeus",
  "license": "GPL-2.0-or-later",
  "sdk": {
    "abi": 1,
    "minVersion": "1.0.0"
  },
  "entrypoint": {
    "assembly": "Eq.dll",
    "type": "Openhpsdr.Zeus.Samples.Eq.EqPlugin"
  },
  "capabilities": [
    "PersistSettings"
  ],
  "audio": {
    "slot": "tx.pre-cfc",
    "channels": 1,
    "sampleRate": 48000
  },
  "ui": {
    "modules": [
      "ui/eq.es.js"
    ],
    "panels": [
      {
        "id": "eq.main",
        "title": "10-Band EQ",
        "icon": "BarChart3",
        "slot": "tx-audio-tools.chain"
      }
    ]
  }
}
