{
  "schemaVersion": 1,
  "id": "com.openhpsdr.zeus.samples.eq",
  "name": "10-Band Parametric EQ (audio chain v1)",
  "version": "0.1.0",
  "author": "KB2UKA",
  "description": "10-band parametric EQ — first of the Zeus voice audio chain v1 blocks per issue #332. Per-band frequency / gain / Q + bypass. Cascaded biquad peaking filters per the RBJ Audio EQ Cookbook. Realtime managed C#, no native dependency. Live combined transfer-function curve, rotary knobs, segmented LED meters in Zeus tokens.",
  "homepage": "https://github.com/Kb2uka/openhpsdr-zeus",
  "license": "GPL-2.0-or-later",
  "sdk": {
    "abi": 1,
    "minVersion": "1.0.0"
  },
  "entrypoint": {
    "assembly": "Eq.dll",
    "type": "Openhpsdr.Zeus.Samples.Eq.EqPlugin"
  },
  "capabilities": [
    "PersistSettings"
  ],
  "audio": {
    "slot": "tx.pre-cfc",
    "channels": 1,
    "sampleRate": 48000
  },
  "ui": {
    "modules": [
      "ui/eq.es.js"
    ],
    "panels": [
      {
        "id": "eq.main",
        "title": "10-Band EQ",
        "icon": "BarChart3",
        "slot": "tx-audio-tools.chain"
      }
    ]
  }
}
